{
  "schema": "rusty.fleet.kiosk_show_controls_operation.v1",
  "operation_id": "show-controls-operation-0001",
  "action_id": "kiosk.show-controls",
  "created_at_ms": 2000000000000,
  "preview": {
    "schema": "rusty.fleet.kiosk_show_controls_preview.v1",
    "preview_id": "show-controls-preview-0001",
    "operation_id": "show-controls-operation-0001",
    "action_id": "kiosk.show-controls",
    "created_at_ms": 2000000000000,
    "expires_at_ms": 2000000060000,
    "fleet_revision": 44,
    "owner_contract": {
      "owner_repo_id": "rusty-kiosk",
      "owner_contract_schema": "rusty.kiosk.direct_operator.v1",
      "owner_contract_revision": "8954228f9ae67c5995a72569e3c9cdd3758f85c0",
      "capability_id": "rusty-kiosk.direct-operator",
      "request_auth": "hmac-sha256-v1",
      "response_auth": "hmac-sha256-response-v1",
      "invoke_method": "POST",
      "invoke_target": "/v1/kiosk/invoke",
      "result_method": "GET",
      "result_target": "/v1/kiosk/result",
      "result_request_id_parameter": "request_id",
      "port": 39873,
      "max_clock_skew_seconds": 90,
      "command": "show-controls",
      "command_value": null,
      "owner_result_schema": "rusty.kiosk.cli_result.v1"
    },
    "targets": [
      {
        "device_id": "sim-00001",
        "identity_revision": 7,
        "capability_id": "rusty-kiosk.direct-operator",
        "capability_evidence_revision": 31,
        "capability_owner": "rusty-kiosk",
        "support": "supported",
        "enablement": "enabled",
        "authorization": "authorized",
        "reachability": "reachable",
        "freshness": "current",
        "observed_at_ms": 1999999999900,
        "fresh_until_ms": 2000000030000,
        "evaluated_at_ms": 2000000000100,
        "eligible": true,
        "reason_code": "ready",
        "message": "Kiosk direct operator is current and ready."
      },
      {
        "device_id": "sim-00002",
        "identity_revision": 3,
        "capability_id": "rusty-kiosk.direct-operator",
        "capability_evidence_revision": 18,
        "capability_owner": "rusty-kiosk",
        "support": "supported",
        "enablement": "enabled",
        "authorization": "unauthorized",
        "reachability": "reachable",
        "freshness": "current",
        "observed_at_ms": 1999999999800,
        "fresh_until_ms": 2000000030000,
        "evaluated_at_ms": 2000000000100,
        "eligible": false,
        "reason_code": "unauthorized",
        "message": "Kiosk direct operator is not authorized for this target."
      }
    ]
  },
  "lifecycle": "applied",
  "max_parallelism": 8,
  "max_attempts_per_target": 3,
  "cleanup_required": false,
  "targets": [
    {
      "device_id": "sim-00001",
      "identity_revision": 7,
      "preflight": {
        "device_id": "sim-00001",
        "identity_revision": 7,
        "capability_id": "rusty-kiosk.direct-operator",
        "capability_evidence_revision": 31,
        "capability_owner": "rusty-kiosk",
        "support": "supported",
        "enablement": "enabled",
        "authorization": "authorized",
        "reachability": "reachable",
        "freshness": "current",
        "observed_at_ms": 1999999999900,
        "fresh_until_ms": 2000000030000,
        "evaluated_at_ms": 2000000000100,
        "eligible": true,
        "reason_code": "ready",
        "message": "Kiosk direct operator is current and ready."
      },
      "lifecycle": "applied",
      "dispatched_at_ms": 2000000000200,
      "owner_deadline_at_ms": 2000000060000,
      "attempt_count": 1,
      "owner_request_ids": [
        "fleetctl-0001"
      ],
      "owner_request_id": "fleetctl-0001",
      "effective_receipt": {
        "schema": "rusty.fleet.kiosk_effective_receipt.v1",
        "receipt_id": "show-controls-receipt-0001",
        "operation_id": "show-controls-operation-0001",
        "device_id": "sim-00001",
        "identity_revision": 7,
        "owner_contract": {
          "owner_repo_id": "rusty-kiosk",
          "owner_contract_schema": "rusty.kiosk.direct_operator.v1",
          "owner_contract_revision": "8954228f9ae67c5995a72569e3c9cdd3758f85c0",
          "capability_id": "rusty-kiosk.direct-operator",
          "request_auth": "hmac-sha256-v1",
          "response_auth": "hmac-sha256-response-v1",
          "invoke_method": "POST",
          "invoke_target": "/v1/kiosk/invoke",
          "result_method": "GET",
          "result_target": "/v1/kiosk/result",
          "result_request_id_parameter": "request_id",
          "port": 39873,
          "max_clock_skew_seconds": 90,
          "command": "show-controls",
          "command_value": null,
          "owner_result_schema": "rusty.kiosk.cli_result.v1"
        },
        "owner_action_request_id": "fleetctl-0001",
        "owner_result_transport_request_id": "fleet-poll-0001",
        "owner_command": "show-controls",
        "response_status": 200,
        "response_content_sha256": "aaaaaaaaaaaaaaaaaaaaaaaaaaaaaaaaaaaaaaaaaaaaaaaaaaaaaaaaaaaaaaaa",
        "response_signature": "bbbbbbbbbbbbbbbbbbbbbbbbbbbbbbbbbbbbbbbbbbbbbbbbbbbbbbbbbbbbbbbb",
        "response_auth_verified": true,
        "owner_result_schema": "rusty.kiosk.cli_result.v1",
        "owner_accepted": true,
        "owner_completed": true,
        "owner_recorded_at_ms": 2000000001500,
        "controls_open": true,
        "wrapped_at_ms": 2000000001600
      },
      "retry_disposition": "not_eligible",
      "cancel_disposition": "terminal",
      "reason_code": "owner_effective_receipt",
      "message": "Kiosk reported the controls surface open.",
      "last_transition_ms": 2000000001600
    },
    {
      "device_id": "sim-00002",
      "identity_revision": 3,
      "preflight": {
        "device_id": "sim-00002",
        "identity_revision": 3,
        "capability_id": "rusty-kiosk.direct-operator",
        "capability_evidence_revision": 18,
        "capability_owner": "rusty-kiosk",
        "support": "supported",
        "enablement": "enabled",
        "authorization": "unauthorized",
        "reachability": "reachable",
        "freshness": "current",
        "observed_at_ms": 1999999999800,
        "fresh_until_ms": 2000000030000,
        "evaluated_at_ms": 2000000000100,
        "eligible": false,
        "reason_code": "unauthorized",
        "message": "Kiosk direct operator is not authorized for this target."
      },
      "lifecycle": "rejected",
      "dispatched_at_ms": null,
      "owner_deadline_at_ms": null,
      "attempt_count": 0,
      "owner_request_ids": [],
      "owner_request_id": null,
      "effective_receipt": null,
      "retry_disposition": "not_eligible",
      "cancel_disposition": "terminal",
      "reason_code": "unauthorized",
      "message": "Target was excluded before dispatch.",
      "last_transition_ms": 2000000000100
    }
  ]
}
